<!DOCTYPE type SYSTEM "../type.dtd">
<class>
	<header>
		<modified>False</modified>
		<frozen>False</frozen>
		<expanded>False</expanded>
		<deferred>True</deferred>
		<generic>False</generic>
		<class_eiffel_name>SYSTEM_RUNTIME_REMOTING_CHANNELS_ICLIENTFORMATTERSINK</class_eiffel_name>
		<alias>
			<simple_name>IClientFormatterSink</simple_name>
			<namespace>System.Runtime.Remoting.Channels</namespace>
			<assembly_name>mscorlib</assembly_name>
			<assembly_version>1.0.2411.0</assembly_version>
			<assembly_culture>neutral</assembly_culture>
			<assembly_public_key>b77a5c561934e089</assembly_public_key>
		</alias>
		<inherit>
			<parent>
				<parent_name>SYSTEM_RUNTIME_REMOTING_CHANNELS_ICHANNELSINKBASE</parent_name>
			</parent>
			<parent>
				<parent_name>SYSTEM_RUNTIME_REMOTING_MESSAGING_IMESSAGESINK</parent_name>
			</parent>
			<parent>
				<parent_name>SYSTEM_RUNTIME_REMOTING_CHANNELS_ICLIENTCHANNELSINK</parent_name>
			</parent>
		</inherit>
		<create_none>False</create_none>
	</header>
	<body>
		<bit_or_infix>False</bit_or_infix>
	</body>
</class>