<!DOCTYPE type SYSTEM "../type.dtd">
<class>
	<header>
		<modified>False</modified>
		<frozen>False</frozen>
		<expanded>False</expanded>
		<deferred>True</deferred>
		<generic>False</generic>
		<class_eiffel_name>SYSTEM_COMPONENTMODEL_DESIGN_IROOTDESIGNER</class_eiffel_name>
		<alias>
			<simple_name>IRootDesigner</simple_name>
			<namespace>System.ComponentModel.Design</namespace>
			<assembly_name>System</assembly_name>
			<assembly_version>1.0.2411.0</assembly_version>
			<assembly_culture>neutral</assembly_culture>
			<assembly_public_key>b77a5c561934e089</assembly_public_key>
		</alias>
		<inherit>
			<parent>
				<parent_name>SYSTEM_COMPONENTMODEL_DESIGN_IDESIGNER</parent_name>
			</parent>
			<parent>
				<parent_name>SYSTEM_IDISPOSABLE</parent_name>
			</parent>
		</inherit>
		<create_none>False</create_none>
	</header>
	<body>
		<access>
			<feature>
				<feature_modified>False</feature_modified>
				<frozen_feature>False</frozen_feature>
				<static>False</static>
				<abstract>True</abstract>
				<method>True</method>
				<field>False</field>
				<creation_routine>False</creation_routine>
				<prefix>False</prefix>
				<infix>False</infix>
				<new_slot>True</new_slot>
				<enum_literal>False</enum_literal>
				<is_literal>False</is_literal>
				<feature_eiffel_name>get_supported_technologies</feature_eiffel_name>
				<feature_external_name>get_SupportedTechnologies</feature_external_name>
				<return_type>ARRAY [SYSTEM_COMPONENTMODEL_DESIGN_VIEWTECHNOLOGY]</return_type>
				<return_type_full_name>System.ComponentModel.Design.ViewTechnology[]</return_type_full_name>
			</feature>
		</access>
		<basic_operations>
			<feature>
				<feature_modified>False</feature_modified>
				<frozen_feature>False</frozen_feature>
				<static>False</static>
				<abstract>True</abstract>
				<method>True</method>
				<field>False</field>
				<creation_routine>False</creation_routine>
				<prefix>False</prefix>
				<infix>False</infix>
				<new_slot>True</new_slot>
				<enum_literal>False</enum_literal>
				<is_literal>False</is_literal>
				<feature_eiffel_name>get_view</feature_eiffel_name>
				<feature_external_name>GetView</feature_external_name>
				<arguments>
					<argument>
						<argument_eiffel_name>technology</argument_eiffel_name>
						<argument_external_name>technology</argument_external_name>
						<argument_type>SYSTEM_COMPONENTMODEL_DESIGN_VIEWTECHNOLOGY</argument_type>
						<argument_type_full_name>System.ComponentModel.Design.ViewTechnology</argument_type_full_name>
					</argument>
				</arguments>
				<return_type>ANY</return_type>
				<return_type_full_name>System.Object</return_type_full_name>
			</feature>
		</basic_operations>
		<bit_or_infix>False</bit_or_infix>
	</body>
</class>