<!DOCTYPE type SYSTEM "../type.dtd">
<class>
	<header>
		<modified>False</modified>
		<frozen>False</frozen>
		<expanded>False</expanded>
		<deferred>False</deferred>
		<generic>False</generic>
		<class_eiffel_name>SYSTEM_DIAGNOSTICS_INSTANCEDATACOLLECTION</class_eiffel_name>
		<alias>
			<simple_name>InstanceDataCollection</simple_name>
			<namespace>System.Diagnostics</namespace>
			<assembly_name>System</assembly_name>
			<assembly_version>1.0.2411.0</assembly_version>
			<assembly_culture>neutral</assembly_culture>
			<assembly_public_key>b77a5c561934e089</assembly_public_key>
		</alias>
		<inherit>
			<parent>
				<parent_name>SYSTEM_COLLECTIONS_IDICTIONARY</parent_name>
				<rename>get_enumerator as ienumerable_get_enumerator, remove as idictionary_remove, extend as idictionary_extend, has as idictionary_has, put_i_th as idictionary_put_i_th, get_item as idictionary_get_item, get_values as idictionary_get_values, get_sync_root as icollection_get_sync_root, get_keys as idictionary_get_keys, get_is_synchronized as icollection_get_is_synchronized, get_is_fixed_size as idictionary_get_is_fixed_size, get_is_read_only as idictionary_get_is_read_only</rename>
			</parent>
			<parent>
				<parent_name>SYSTEM_COLLECTIONS_IENUMERABLE</parent_name>
				<rename>get_enumerator as ienumerable_get_enumerator</rename>
			</parent>
			<parent>
				<parent_name>SYSTEM_COLLECTIONS_ICOLLECTION</parent_name>
				<rename>get_enumerator as ienumerable_get_enumerator, get_sync_root as icollection_get_sync_root, get_is_synchronized as icollection_get_is_synchronized</rename>
			</parent>
			<parent>
				<parent_name>SYSTEM_COLLECTIONS_DICTIONARYBASE</parent_name>
			</parent>
		</inherit>
		<create_none>False</create_none>
	</header>
	<body>
		<initialization>
			<feature>
				<feature_modified>False</feature_modified>
				<frozen_feature>True</frozen_feature>
				<static>False</static>
				<abstract>False</abstract>
				<method>False</method>
				<field>False</field>
				<creation_routine>True</creation_routine>
				<prefix>False</prefix>
				<infix>False</infix>
				<new_slot>False</new_slot>
				<enum_literal>False</enum_literal>
				<is_literal>False</is_literal>
				<feature_eiffel_name>make_instancedatacollection</feature_eiffel_name>
				<arguments>
					<argument>
						<argument_eiffel_name>counter_name</argument_eiffel_name>
						<argument_external_name>counterName</argument_external_name>
						<argument_type>STRING</argument_type>
						<argument_type_full_name>System.String</argument_type_full_name>
					</argument>
				</arguments>
			</feature>
		</initialization>
		<access>
			<feature>
				<feature_modified>False</feature_modified>
				<frozen_feature>True</frozen_feature>
				<static>False</static>
				<abstract>False</abstract>
				<method>True</method>
				<field>False</field>
				<creation_routine>False</creation_routine>
				<prefix>False</prefix>
				<infix>False</infix>
				<new_slot>True</new_slot>
				<enum_literal>False</enum_literal>
				<is_literal>False</is_literal>
				<feature_eiffel_name>get_counter_name</feature_eiffel_name>
				<feature_external_name>get_CounterName</feature_external_name>
				<return_type>STRING</return_type>
				<return_type_full_name>System.String</return_type_full_name>
			</feature>
			<feature>
				<feature_modified>False</feature_modified>
				<frozen_feature>True</frozen_feature>
				<static>False</static>
				<abstract>False</abstract>
				<method>True</method>
				<field>False</field>
				<creation_routine>False</creation_routine>
				<prefix>False</prefix>
				<infix>False</infix>
				<new_slot>True</new_slot>
				<enum_literal>False</enum_literal>
				<is_literal>False</is_literal>
				<feature_eiffel_name>get_keys</feature_eiffel_name>
				<feature_external_name>get_Keys</feature_external_name>
				<return_type>SYSTEM_COLLECTIONS_ICOLLECTION</return_type>
				<return_type_full_name>System.Collections.ICollection</return_type_full_name>
			</feature>
			<feature>
				<feature_modified>False</feature_modified>
				<frozen_feature>True</frozen_feature>
				<static>False</static>
				<abstract>False</abstract>
				<method>True</method>
				<field>False</field>
				<creation_routine>False</creation_routine>
				<prefix>False</prefix>
				<infix>False</infix>
				<new_slot>True</new_slot>
				<enum_literal>False</enum_literal>
				<is_literal>False</is_literal>
				<feature_eiffel_name>get_values</feature_eiffel_name>
				<feature_external_name>get_Values</feature_external_name>
				<return_type>SYSTEM_COLLECTIONS_ICOLLECTION</return_type>
				<return_type_full_name>System.Collections.ICollection</return_type_full_name>
			</feature>
			<feature>
				<feature_modified>False</feature_modified>
				<frozen_feature>True</frozen_feature>
				<static>False</static>
				<abstract>False</abstract>
				<method>True</method>
				<field>False</field>
				<creation_routine>False</creation_routine>
				<prefix>False</prefix>
				<infix>False</infix>
				<new_slot>True</new_slot>
				<enum_literal>False</enum_literal>
				<is_literal>False</is_literal>
				<feature_eiffel_name>get_item</feature_eiffel_name>
				<feature_external_name>get_Item</feature_external_name>
				<arguments>
					<argument>
						<argument_eiffel_name>instance_name</argument_eiffel_name>
						<argument_external_name>instanceName</argument_external_name>
						<argument_type>STRING</argument_type>
						<argument_type_full_name>System.String</argument_type_full_name>
					</argument>
				</arguments>
				<return_type>SYSTEM_DIAGNOSTICS_INSTANCEDATA</return_type>
				<return_type_full_name>System.Diagnostics.InstanceData</return_type_full_name>
			</feature>
		</access>
		<basic_operations>
			<feature>
				<feature_modified>False</feature_modified>
				<frozen_feature>True</frozen_feature>
				<static>False</static>
				<abstract>False</abstract>
				<method>True</method>
				<field>False</field>
				<creation_routine>False</creation_routine>
				<prefix>False</prefix>
				<infix>False</infix>
				<new_slot>True</new_slot>
				<enum_literal>False</enum_literal>
				<is_literal>False</is_literal>
				<feature_eiffel_name>copy_to_array_instance_data</feature_eiffel_name>
				<feature_external_name>CopyTo</feature_external_name>
				<arguments>
					<argument>
						<argument_eiffel_name>instances</argument_eiffel_name>
						<argument_external_name>instances</argument_external_name>
						<argument_type>ARRAY [SYSTEM_DIAGNOSTICS_INSTANCEDATA]</argument_type>
						<argument_type_full_name>System.Diagnostics.InstanceData[]</argument_type_full_name>
					</argument>
					<argument>
						<argument_eiffel_name>index</argument_eiffel_name>
						<argument_external_name>index</argument_external_name>
						<argument_type>INTEGER</argument_type>
						<argument_type_full_name>System.Int32</argument_type_full_name>
					</argument>
				</arguments>
				<return_type />
				<return_type_full_name>System.Void</return_type_full_name>
			</feature>
			<feature>
				<feature_modified>False</feature_modified>
				<frozen_feature>True</frozen_feature>
				<static>False</static>
				<abstract>False</abstract>
				<method>True</method>
				<field>False</field>
				<creation_routine>False</creation_routine>
				<prefix>False</prefix>
				<infix>False</infix>
				<new_slot>True</new_slot>
				<enum_literal>False</enum_literal>
				<is_literal>False</is_literal>
				<feature_eiffel_name>has</feature_eiffel_name>
				<feature_external_name>Contains</feature_external_name>
				<arguments>
					<argument>
						<argument_eiffel_name>instance_name</argument_eiffel_name>
						<argument_external_name>instanceName</argument_external_name>
						<argument_type>STRING</argument_type>
						<argument_type_full_name>System.String</argument_type_full_name>
					</argument>
				</arguments>
				<return_type>BOOLEAN</return_type>
				<return_type_full_name>System.Boolean</return_type_full_name>
			</feature>
		</basic_operations>
		<bit_or_infix>False</bit_or_infix>
	</body>
</class>
