<!DOCTYPE type SYSTEM "../type.dtd">
<class>
	<header>
		<modified>False</modified>
		<frozen>False</frozen>
		<expanded>False</expanded>
		<deferred>True</deferred>
		<generic>False</generic>
		<class_eiffel_name>SYSTEM_RUNTIME_INTEROPSERVICES_UCOMIENUMVARIANT</class_eiffel_name>
		<alias>
			<simple_name>UCOMIEnumVARIANT</simple_name>
			<namespace>System.Runtime.InteropServices</namespace>
			<assembly_name>mscorlib</assembly_name>
			<assembly_version>1.0.2411.0</assembly_version>
			<assembly_culture>neutral</assembly_culture>
			<assembly_public_key>b77a5c561934e089</assembly_public_key>
		</alias>
		<inherit>
			<parent>
				<parent_name>ANY</parent_name>
				<undefine>finalize, get_hash_code, equals, to_string</undefine>
			</parent>
		</inherit>
		<create_none>False</create_none>
	</header>
	<body>
		<basic_operations>
			<feature>
				<feature_modified>False</feature_modified>
				<frozen_feature>False</frozen_feature>
				<static>False</static>
				<abstract>True</abstract>
				<method>True</method>
				<field>False</field>
				<creation_routine>False</creation_routine>
				<prefix>False</prefix>
				<infix>False</infix>
				<new_slot>True</new_slot>
				<enum_literal>False</enum_literal>
				<is_literal>False</is_literal>
				<feature_eiffel_name>clone</feature_eiffel_name>
				<feature_external_name>Clone</feature_external_name>
				<arguments>
					<argument>
						<argument_eiffel_name>ppenum</argument_eiffel_name>
						<argument_external_name>ppenum</argument_external_name>
						<argument_type>INTEGER</argument_type>
						<argument_type_full_name>System.Int32</argument_type_full_name>
					</argument>
				</arguments>
				<return_type />
				<return_type_full_name>System.Void</return_type_full_name>
			</feature>
			<feature>
				<feature_modified>False</feature_modified>
				<frozen_feature>False</frozen_feature>
				<static>False</static>
				<abstract>True</abstract>
				<method>True</method>
				<field>False</field>
				<creation_routine>False</creation_routine>
				<prefix>False</prefix>
				<infix>False</infix>
				<new_slot>True</new_slot>
				<enum_literal>False</enum_literal>
				<is_literal>False</is_literal>
				<feature_eiffel_name>reset</feature_eiffel_name>
				<feature_external_name>Reset</feature_external_name>
				<return_type>INTEGER</return_type>
				<return_type_full_name>System.Int32</return_type_full_name>
			</feature>
			<feature>
				<feature_modified>False</feature_modified>
				<frozen_feature>False</frozen_feature>
				<static>False</static>
				<abstract>True</abstract>
				<method>True</method>
				<field>False</field>
				<creation_routine>False</creation_routine>
				<prefix>False</prefix>
				<infix>False</infix>
				<new_slot>True</new_slot>
				<enum_literal>False</enum_literal>
				<is_literal>False</is_literal>
				<feature_eiffel_name>skip</feature_eiffel_name>
				<feature_external_name>Skip</feature_external_name>
				<arguments>
					<argument>
						<argument_eiffel_name>celt</argument_eiffel_name>
						<argument_external_name>celt</argument_external_name>
						<argument_type>INTEGER</argument_type>
						<argument_type_full_name>System.Int32</argument_type_full_name>
					</argument>
				</arguments>
				<return_type>INTEGER</return_type>
				<return_type_full_name>System.Int32</return_type_full_name>
			</feature>
			<feature>
				<feature_modified>False</feature_modified>
				<frozen_feature>False</frozen_feature>
				<static>False</static>
				<abstract>True</abstract>
				<method>True</method>
				<field>False</field>
				<creation_routine>False</creation_routine>
				<prefix>False</prefix>
				<infix>False</infix>
				<new_slot>True</new_slot>
				<enum_literal>False</enum_literal>
				<is_literal>False</is_literal>
				<feature_eiffel_name>next</feature_eiffel_name>
				<feature_external_name>Next</feature_external_name>
				<arguments>
					<argument>
						<argument_eiffel_name>celt</argument_eiffel_name>
						<argument_external_name>celt</argument_external_name>
						<argument_type>INTEGER</argument_type>
						<argument_type_full_name>System.Int32</argument_type_full_name>
					</argument>
					<argument>
						<argument_eiffel_name>rgvar</argument_eiffel_name>
						<argument_external_name>rgvar</argument_external_name>
						<argument_type>INTEGER</argument_type>
						<argument_type_full_name>System.Int32</argument_type_full_name>
					</argument>
					<argument>
						<argument_eiffel_name>pcelt_fetched</argument_eiffel_name>
						<argument_external_name>pceltFetched</argument_external_name>
						<argument_type>INTEGER</argument_type>
						<argument_type_full_name>System.Int32</argument_type_full_name>
					</argument>
				</arguments>
				<return_type>INTEGER</return_type>
				<return_type_full_name>System.Int32</return_type_full_name>
			</feature>
		</basic_operations>
		<bit_or_infix>False</bit_or_infix>
	</body>
</class>