<!DOCTYPE type SYSTEM "../type.dtd">
<class>
	<header>
		<modified>False</modified>
		<frozen>False</frozen>
		<expanded>False</expanded>
		<deferred>False</deferred>
		<generic>False</generic>
		<class_eiffel_name>SYSTEM_DIAGNOSTICS_PERFORMANCECOUNTERPERMISSIONATTRIBUTE</class_eiffel_name>
		<alias>
			<simple_name>PerformanceCounterPermissionAttribute</simple_name>
			<namespace>System.Diagnostics</namespace>
			<assembly_name>System</assembly_name>
			<assembly_version>1.0.2411.0</assembly_version>
			<assembly_culture>neutral</assembly_culture>
			<assembly_public_key>b77a5c561934e089</assembly_public_key>
		</alias>
		<inherit>
			<parent>
				<parent_name>SYSTEM_SECURITY_PERMISSIONS_CODEACCESSSECURITYATTRIBUTE</parent_name>
			</parent>
		</inherit>
		<create_none>False</create_none>
	</header>
	<body>
		<initialization>
			<feature>
				<feature_modified>False</feature_modified>
				<frozen_feature>True</frozen_feature>
				<static>False</static>
				<abstract>False</abstract>
				<method>False</method>
				<field>False</field>
				<creation_routine>True</creation_routine>
				<prefix>False</prefix>
				<infix>False</infix>
				<new_slot>False</new_slot>
				<enum_literal>False</enum_literal>
				<is_literal>False</is_literal>
				<feature_eiffel_name>make_performancecounterpermissionattribute</feature_eiffel_name>
				<arguments>
					<argument>
						<argument_eiffel_name>action</argument_eiffel_name>
						<argument_external_name>action</argument_external_name>
						<argument_type>SYSTEM_SECURITY_PERMISSIONS_SECURITYACTION</argument_type>
						<argument_type_full_name>System.Security.Permissions.SecurityAction</argument_type_full_name>
					</argument>
				</arguments>
			</feature>
		</initialization>
		<access>
			<feature>
				<feature_modified>False</feature_modified>
				<frozen_feature>True</frozen_feature>
				<static>False</static>
				<abstract>False</abstract>
				<method>True</method>
				<field>False</field>
				<creation_routine>False</creation_routine>
				<prefix>False</prefix>
				<infix>False</infix>
				<new_slot>True</new_slot>
				<enum_literal>False</enum_literal>
				<is_literal>False</is_literal>
				<feature_eiffel_name>get_category_name</feature_eiffel_name>
				<feature_external_name>get_CategoryName</feature_external_name>
				<return_type>STRING</return_type>
				<return_type_full_name>System.String</return_type_full_name>
			</feature>
			<feature>
				<feature_modified>False</feature_modified>
				<frozen_feature>True</frozen_feature>
				<static>False</static>
				<abstract>False</abstract>
				<method>True</method>
				<field>False</field>
				<creation_routine>False</creation_routine>
				<prefix>False</prefix>
				<infix>False</infix>
				<new_slot>True</new_slot>
				<enum_literal>False</enum_literal>
				<is_literal>False</is_literal>
				<feature_eiffel_name>get_machine_name</feature_eiffel_name>
				<feature_external_name>get_MachineName</feature_external_name>
				<return_type>STRING</return_type>
				<return_type_full_name>System.String</return_type_full_name>
			</feature>
			<feature>
				<feature_modified>False</feature_modified>
				<frozen_feature>True</frozen_feature>
				<static>False</static>
				<abstract>False</abstract>
				<method>True</method>
				<field>False</field>
				<creation_routine>False</creation_routine>
				<prefix>False</prefix>
				<infix>False</infix>
				<new_slot>True</new_slot>
				<enum_literal>False</enum_literal>
				<is_literal>False</is_literal>
				<feature_eiffel_name>get_permission_access</feature_eiffel_name>
				<feature_external_name>get_PermissionAccess</feature_external_name>
				<return_type>SYSTEM_DIAGNOSTICS_PERFORMANCECOUNTERPERMISSIONACCESS</return_type>
				<return_type_full_name>System.Diagnostics.PerformanceCounterPermissionAccess</return_type_full_name>
			</feature>
		</access>
		<element_change>
			<feature>
				<feature_modified>False</feature_modified>
				<frozen_feature>True</frozen_feature>
				<static>False</static>
				<abstract>False</abstract>
				<method>True</method>
				<field>False</field>
				<creation_routine>False</creation_routine>
				<prefix>False</prefix>
				<infix>False</infix>
				<new_slot>True</new_slot>
				<enum_literal>False</enum_literal>
				<is_literal>False</is_literal>
				<feature_eiffel_name>set_permission_access</feature_eiffel_name>
				<feature_external_name>set_PermissionAccess</feature_external_name>
				<arguments>
					<argument>
						<argument_eiffel_name>value</argument_eiffel_name>
						<argument_external_name>value</argument_external_name>
						<argument_type>SYSTEM_DIAGNOSTICS_PERFORMANCECOUNTERPERMISSIONACCESS</argument_type>
						<argument_type_full_name>System.Diagnostics.PerformanceCounterPermissionAccess</argument_type_full_name>
					</argument>
				</arguments>
				<return_type />
				<return_type_full_name>System.Void</return_type_full_name>
			</feature>
			<feature>
				<feature_modified>False</feature_modified>
				<frozen_feature>True</frozen_feature>
				<static>False</static>
				<abstract>False</abstract>
				<method>True</method>
				<field>False</field>
				<creation_routine>False</creation_routine>
				<prefix>False</prefix>
				<infix>False</infix>
				<new_slot>True</new_slot>
				<enum_literal>False</enum_literal>
				<is_literal>False</is_literal>
				<feature_eiffel_name>set_machine_name</feature_eiffel_name>
				<feature_external_name>set_MachineName</feature_external_name>
				<arguments>
					<argument>
						<argument_eiffel_name>value</argument_eiffel_name>
						<argument_external_name>value</argument_external_name>
						<argument_type>STRING</argument_type>
						<argument_type_full_name>System.String</argument_type_full_name>
					</argument>
				</arguments>
				<return_type />
				<return_type_full_name>System.Void</return_type_full_name>
			</feature>
			<feature>
				<feature_modified>False</feature_modified>
				<frozen_feature>True</frozen_feature>
				<static>False</static>
				<abstract>False</abstract>
				<method>True</method>
				<field>False</field>
				<creation_routine>False</creation_routine>
				<prefix>False</prefix>
				<infix>False</infix>
				<new_slot>True</new_slot>
				<enum_literal>False</enum_literal>
				<is_literal>False</is_literal>
				<feature_eiffel_name>set_category_name</feature_eiffel_name>
				<feature_external_name>set_CategoryName</feature_external_name>
				<arguments>
					<argument>
						<argument_eiffel_name>value</argument_eiffel_name>
						<argument_external_name>value</argument_external_name>
						<argument_type>STRING</argument_type>
						<argument_type_full_name>System.String</argument_type_full_name>
					</argument>
				</arguments>
				<return_type />
				<return_type_full_name>System.Void</return_type_full_name>
			</feature>
		</element_change>
		<basic_operations>
			<feature>
				<feature_modified>False</feature_modified>
				<frozen_feature>False</frozen_feature>
				<static>False</static>
				<abstract>False</abstract>
				<method>True</method>
				<field>False</field>
				<creation_routine>False</creation_routine>
				<prefix>False</prefix>
				<infix>False</infix>
				<new_slot>False</new_slot>
				<enum_literal>False</enum_literal>
				<is_literal>False</is_literal>
				<feature_eiffel_name>create_permission</feature_eiffel_name>
				<feature_external_name>CreatePermission</feature_external_name>
				<return_type>SYSTEM_SECURITY_IPERMISSION</return_type>
				<return_type_full_name>System.Security.IPermission</return_type_full_name>
			</feature>
		</basic_operations>
		<bit_or_infix>False</bit_or_infix>
	</body>
</class>