<!DOCTYPE type SYSTEM "../type.dtd">
<class>
	<header>
		<modified>False</modified>
		<frozen>False</frozen>
		<expanded>False</expanded>
		<deferred>False</deferred>
		<generic>False</generic>
		<class_eiffel_name>SYSTEM_COMPONENTMODEL_DESIGN_DESIGNTIMELICENSECONTEXTSERIALIZER</class_eiffel_name>
		<alias>
			<simple_name>DesigntimeLicenseContextSerializer</simple_name>
			<namespace>System.ComponentModel.Design</namespace>
			<assembly_name>System</assembly_name>
			<assembly_version>1.0.2411.0</assembly_version>
			<assembly_culture>neutral</assembly_culture>
			<assembly_public_key>b77a5c561934e089</assembly_public_key>
		</alias>
		<create_none>True</create_none>
	</header>
	<body>
		<basic_operations>
			<feature>
				<feature_modified>False</feature_modified>
				<frozen_feature>True</frozen_feature>
				<static>True</static>
				<abstract>False</abstract>
				<method>True</method>
				<field>False</field>
				<creation_routine>False</creation_routine>
				<prefix>False</prefix>
				<infix>False</infix>
				<new_slot>True</new_slot>
				<enum_literal>False</enum_literal>
				<is_literal>False</is_literal>
				<feature_eiffel_name>serialize</feature_eiffel_name>
				<feature_external_name>Serialize</feature_external_name>
				<arguments>
					<argument>
						<argument_eiffel_name>o</argument_eiffel_name>
						<argument_external_name>o</argument_external_name>
						<argument_type>SYSTEM_IO_STREAM</argument_type>
						<argument_type_full_name>System.IO.Stream</argument_type_full_name>
					</argument>
					<argument>
						<argument_eiffel_name>crypto_key</argument_eiffel_name>
						<argument_external_name>cryptoKey</argument_external_name>
						<argument_type>STRING</argument_type>
						<argument_type_full_name>System.String</argument_type_full_name>
					</argument>
					<argument>
						<argument_eiffel_name>context</argument_eiffel_name>
						<argument_external_name>context</argument_external_name>
						<argument_type>SYSTEM_COMPONENTMODEL_DESIGN_DESIGNTIMELICENSECONTEXT</argument_type>
						<argument_type_full_name>System.ComponentModel.Design.DesigntimeLicenseContext</argument_type_full_name>
					</argument>
				</arguments>
				<return_type />
				<return_type_full_name>System.Void</return_type_full_name>
			</feature>
		</basic_operations>
		<bit_or_infix>False</bit_or_infix>
	</body>
</class>