<!DOCTYPE type SYSTEM "../type.dtd">
<class>
	<header>
		<modified>False</modified>
		<frozen>False</frozen>
		<expanded>False</expanded>
		<deferred>False</deferred>
		<generic>False</generic>
		<class_eiffel_name>SYSTEM_WEB_HANDLERS_TRACEHANDLER</class_eiffel_name>
		<alias>
			<simple_name>TraceHandler</simple_name>
			<namespace>System.Web.Handlers</namespace>
			<assembly_name>System.Web</assembly_name>
			<assembly_version>1.0.2411.0</assembly_version>
			<assembly_culture>neutral</assembly_culture>
			<assembly_public_key>b03f5f7f11d50a3a</assembly_public_key>
		</alias>
		<inherit>
			<parent>
				<parent_name>SYSTEM_WEB_IHTTPHANDLER</parent_name>
				<rename>get_is_reusable as system_web_ihttp_handler_get_is_reusable, process_request as system_web_ihttp_handler_process_request</rename>
			</parent>
			<parent>
				<parent_name>ANY</parent_name>
				<redefine>finalize, get_hash_code, is_equal, to_string</redefine>
			</parent>
		</inherit>
		<create_none>False</create_none>
	</header>
	<body>
		<initialization>
			<feature>
				<feature_modified>False</feature_modified>
				<frozen_feature>True</frozen_feature>
				<static>False</static>
				<abstract>False</abstract>
				<method>False</method>
				<field>False</field>
				<creation_routine>True</creation_routine>
				<prefix>False</prefix>
				<infix>False</infix>
				<new_slot>False</new_slot>
				<enum_literal>False</enum_literal>
				<is_literal>False</is_literal>
				<feature_eiffel_name>make</feature_eiffel_name>
			</feature>
		</initialization>
		<basic_operations>
			<feature>
				<feature_modified>False</feature_modified>
				<frozen_feature>False</frozen_feature>
				<static>False</static>
				<abstract>False</abstract>
				<method>True</method>
				<field>False</field>
				<creation_routine>False</creation_routine>
				<prefix>False</prefix>
				<infix>False</infix>
				<new_slot>False</new_slot>
				<enum_literal>False</enum_literal>
				<is_literal>False</is_literal>
				<feature_eiffel_name>get_hash_code</feature_eiffel_name>
				<feature_external_name>GetHashCode</feature_external_name>
				<return_type>INTEGER</return_type>
				<return_type_full_name>System.Int32</return_type_full_name>
			</feature>
			<feature>
				<feature_modified>False</feature_modified>
				<frozen_feature>False</frozen_feature>
				<static>False</static>
				<abstract>False</abstract>
				<method>True</method>
				<field>False</field>
				<creation_routine>False</creation_routine>
				<prefix>False</prefix>
				<infix>False</infix>
				<new_slot>False</new_slot>
				<enum_literal>False</enum_literal>
				<is_literal>False</is_literal>
				<feature_eiffel_name>to_string</feature_eiffel_name>
				<feature_external_name>ToString</feature_external_name>
				<return_type>STRING</return_type>
				<return_type_full_name>System.String</return_type_full_name>
			</feature>
			<feature>
				<feature_modified>False</feature_modified>
				<frozen_feature>False</frozen_feature>
				<static>False</static>
				<abstract>False</abstract>
				<method>True</method>
				<field>False</field>
				<creation_routine>False</creation_routine>
				<prefix>False</prefix>
				<infix>False</infix>
				<new_slot>False</new_slot>
				<enum_literal>False</enum_literal>
				<is_literal>False</is_literal>
				<feature_eiffel_name>is_equal</feature_eiffel_name>
				<feature_external_name>Equals</feature_external_name>
				<arguments>
					<argument>
						<argument_eiffel_name>obj</argument_eiffel_name>
						<argument_external_name>obj</argument_external_name>
						<argument_type>ANY</argument_type>
						<argument_type_full_name>System.Object</argument_type_full_name>
					</argument>
				</arguments>
				<return_type>BOOLEAN</return_type>
				<return_type_full_name>System.Boolean</return_type_full_name>
			</feature>
		</basic_operations>
		<implementation>
			<feature>
				<feature_modified>False</feature_modified>
				<frozen_feature>True</frozen_feature>
				<static>False</static>
				<abstract>False</abstract>
				<method>True</method>
				<field>False</field>
				<creation_routine>False</creation_routine>
				<prefix>False</prefix>
				<infix>False</infix>
				<new_slot>True</new_slot>
				<enum_literal>False</enum_literal>
				<is_literal>False</is_literal>
				<feature_eiffel_name>show_details</feature_eiffel_name>
				<feature_external_name>ShowDetails</feature_external_name>
				<arguments>
					<argument>
						<argument_eiffel_name>data</argument_eiffel_name>
						<argument_external_name>data</argument_external_name>
						<argument_type>SYSTEM_DATA_DATASET</argument_type>
						<argument_type_full_name>System.Data.DataSet</argument_type_full_name>
					</argument>
				</arguments>
				<return_type />
				<return_type_full_name>System.Void</return_type_full_name>
			</feature>
			<feature>
				<feature_modified>False</feature_modified>
				<frozen_feature>True</frozen_feature>
				<static>False</static>
				<abstract>False</abstract>
				<method>True</method>
				<field>False</field>
				<creation_routine>False</creation_routine>
				<prefix>False</prefix>
				<infix>False</infix>
				<new_slot>True</new_slot>
				<enum_literal>False</enum_literal>
				<is_literal>False</is_literal>
				<feature_eiffel_name>system_web_ihttp_handler_process_request</feature_eiffel_name>
				<feature_external_name>System.Web.IHttpHandler.ProcessRequest</feature_external_name>
				<arguments>
					<argument>
						<argument_eiffel_name>context</argument_eiffel_name>
						<argument_external_name>context</argument_external_name>
						<argument_type>SYSTEM_WEB_HTTPCONTEXT</argument_type>
						<argument_type_full_name>System.Web.HttpContext</argument_type_full_name>
					</argument>
				</arguments>
				<return_type />
				<return_type_full_name>System.Void</return_type_full_name>
			</feature>
			<feature>
				<feature_modified>False</feature_modified>
				<frozen_feature>False</frozen_feature>
				<static>False</static>
				<abstract>False</abstract>
				<method>True</method>
				<field>False</field>
				<creation_routine>False</creation_routine>
				<prefix>False</prefix>
				<infix>False</infix>
				<new_slot>False</new_slot>
				<enum_literal>False</enum_literal>
				<is_literal>False</is_literal>
				<feature_eiffel_name>finalize</feature_eiffel_name>
				<feature_external_name>Finalize</feature_external_name>
				<return_type />
				<return_type_full_name>System.Void</return_type_full_name>
			</feature>
			<feature>
				<feature_modified>False</feature_modified>
				<frozen_feature>True</frozen_feature>
				<static>False</static>
				<abstract>False</abstract>
				<method>True</method>
				<field>False</field>
				<creation_routine>False</creation_routine>
				<prefix>False</prefix>
				<infix>False</infix>
				<new_slot>True</new_slot>
				<enum_literal>False</enum_literal>
				<is_literal>False</is_literal>
				<feature_eiffel_name>show_requests</feature_eiffel_name>
				<feature_external_name>ShowRequests</feature_external_name>
				<arguments>
					<argument>
						<argument_eiffel_name>datasets</argument_eiffel_name>
						<argument_external_name>datasets</argument_external_name>
						<argument_type>SYSTEM_COLLECTIONS_ARRAYLIST</argument_type>
						<argument_type_full_name>System.Collections.ArrayList</argument_type_full_name>
					</argument>
				</arguments>
				<return_type />
				<return_type_full_name>System.Void</return_type_full_name>
			</feature>
			<feature>
				<feature_modified>False</feature_modified>
				<frozen_feature>True</frozen_feature>
				<static>False</static>
				<abstract>False</abstract>
				<method>True</method>
				<field>False</field>
				<creation_routine>False</creation_routine>
				<prefix>False</prefix>
				<infix>False</infix>
				<new_slot>True</new_slot>
				<enum_literal>False</enum_literal>
				<is_literal>False</is_literal>
				<feature_eiffel_name>system_web_ihttp_handler_get_is_reusable</feature_eiffel_name>
				<feature_external_name>System.Web.IHttpHandler.get_IsReusable</feature_external_name>
				<return_type>BOOLEAN</return_type>
				<return_type_full_name>System.Boolean</return_type_full_name>
			</feature>
		</implementation>
		<bit_or_infix>False</bit_or_infix>
	</body>
</class>
