<!DOCTYPE type SYSTEM "../type.dtd">
<class>
	<header>
		<modified>False</modified>
		<frozen>False</frozen>
		<expanded>False</expanded>
		<deferred>False</deferred>
		<generic>False</generic>
		<class_eiffel_name>SYSTEM_RUNTIME_REMOTING_LIFETIME_LIFETIMESERVICES</class_eiffel_name>
		<alias>
			<simple_name>LifetimeServices</simple_name>
			<namespace>System.Runtime.Remoting.Lifetime</namespace>
			<assembly_name>mscorlib</assembly_name>
			<assembly_version>1.0.2411.0</assembly_version>
			<assembly_culture>neutral</assembly_culture>
			<assembly_public_key>b77a5c561934e089</assembly_public_key>
		</alias>
		<create_none>False</create_none>
	</header>
	<body>
		<initialization>
			<feature>
				<feature_modified>False</feature_modified>
				<frozen_feature>True</frozen_feature>
				<static>False</static>
				<abstract>False</abstract>
				<method>False</method>
				<field>False</field>
				<creation_routine>True</creation_routine>
				<prefix>False</prefix>
				<infix>False</infix>
				<new_slot>False</new_slot>
				<enum_literal>False</enum_literal>
				<is_literal>False</is_literal>
				<feature_eiffel_name>make</feature_eiffel_name>
			</feature>
		</initialization>
		<access>
			<feature>
				<feature_modified>False</feature_modified>
				<frozen_feature>True</frozen_feature>
				<static>True</static>
				<abstract>False</abstract>
				<method>True</method>
				<field>False</field>
				<creation_routine>False</creation_routine>
				<prefix>False</prefix>
				<infix>False</infix>
				<new_slot>True</new_slot>
				<enum_literal>False</enum_literal>
				<is_literal>False</is_literal>
				<feature_eiffel_name>get_renew_on_call_time</feature_eiffel_name>
				<feature_external_name>get_RenewOnCallTime</feature_external_name>
				<return_type>SYSTEM_TIMESPAN</return_type>
				<return_type_full_name>System.TimeSpan</return_type_full_name>
			</feature>
			<feature>
				<feature_modified>False</feature_modified>
				<frozen_feature>True</frozen_feature>
				<static>True</static>
				<abstract>False</abstract>
				<method>True</method>
				<field>False</field>
				<creation_routine>False</creation_routine>
				<prefix>False</prefix>
				<infix>False</infix>
				<new_slot>True</new_slot>
				<enum_literal>False</enum_literal>
				<is_literal>False</is_literal>
				<feature_eiffel_name>get_sponsorship_timeout</feature_eiffel_name>
				<feature_external_name>get_SponsorshipTimeout</feature_external_name>
				<return_type>SYSTEM_TIMESPAN</return_type>
				<return_type_full_name>System.TimeSpan</return_type_full_name>
			</feature>
			<feature>
				<feature_modified>False</feature_modified>
				<frozen_feature>True</frozen_feature>
				<static>True</static>
				<abstract>False</abstract>
				<method>True</method>
				<field>False</field>
				<creation_routine>False</creation_routine>
				<prefix>False</prefix>
				<infix>False</infix>
				<new_slot>True</new_slot>
				<enum_literal>False</enum_literal>
				<is_literal>False</is_literal>
				<feature_eiffel_name>get_lease_time</feature_eiffel_name>
				<feature_external_name>get_LeaseTime</feature_external_name>
				<return_type>SYSTEM_TIMESPAN</return_type>
				<return_type_full_name>System.TimeSpan</return_type_full_name>
			</feature>
			<feature>
				<feature_modified>False</feature_modified>
				<frozen_feature>True</frozen_feature>
				<static>True</static>
				<abstract>False</abstract>
				<method>True</method>
				<field>False</field>
				<creation_routine>False</creation_routine>
				<prefix>False</prefix>
				<infix>False</infix>
				<new_slot>True</new_slot>
				<enum_literal>False</enum_literal>
				<is_literal>False</is_literal>
				<feature_eiffel_name>get_lease_manager_poll_time</feature_eiffel_name>
				<feature_external_name>get_LeaseManagerPollTime</feature_external_name>
				<return_type>SYSTEM_TIMESPAN</return_type>
				<return_type_full_name>System.TimeSpan</return_type_full_name>
			</feature>
		</access>
		<element_change>
			<feature>
				<feature_modified>False</feature_modified>
				<frozen_feature>True</frozen_feature>
				<static>True</static>
				<abstract>False</abstract>
				<method>True</method>
				<field>False</field>
				<creation_routine>False</creation_routine>
				<prefix>False</prefix>
				<infix>False</infix>
				<new_slot>True</new_slot>
				<enum_literal>False</enum_literal>
				<is_literal>False</is_literal>
				<feature_eiffel_name>set_lease_manager_poll_time</feature_eiffel_name>
				<feature_external_name>set_LeaseManagerPollTime</feature_external_name>
				<arguments>
					<argument>
						<argument_eiffel_name>value</argument_eiffel_name>
						<argument_external_name>value</argument_external_name>
						<argument_type>SYSTEM_TIMESPAN</argument_type>
						<argument_type_full_name>System.TimeSpan</argument_type_full_name>
					</argument>
				</arguments>
				<return_type />
				<return_type_full_name>System.Void</return_type_full_name>
			</feature>
			<feature>
				<feature_modified>False</feature_modified>
				<frozen_feature>True</frozen_feature>
				<static>True</static>
				<abstract>False</abstract>
				<method>True</method>
				<field>False</field>
				<creation_routine>False</creation_routine>
				<prefix>False</prefix>
				<infix>False</infix>
				<new_slot>True</new_slot>
				<enum_literal>False</enum_literal>
				<is_literal>False</is_literal>
				<feature_eiffel_name>set_renew_on_call_time</feature_eiffel_name>
				<feature_external_name>set_RenewOnCallTime</feature_external_name>
				<arguments>
					<argument>
						<argument_eiffel_name>value</argument_eiffel_name>
						<argument_external_name>value</argument_external_name>
						<argument_type>SYSTEM_TIMESPAN</argument_type>
						<argument_type_full_name>System.TimeSpan</argument_type_full_name>
					</argument>
				</arguments>
				<return_type />
				<return_type_full_name>System.Void</return_type_full_name>
			</feature>
			<feature>
				<feature_modified>False</feature_modified>
				<frozen_feature>True</frozen_feature>
				<static>True</static>
				<abstract>False</abstract>
				<method>True</method>
				<field>False</field>
				<creation_routine>False</creation_routine>
				<prefix>False</prefix>
				<infix>False</infix>
				<new_slot>True</new_slot>
				<enum_literal>False</enum_literal>
				<is_literal>False</is_literal>
				<feature_eiffel_name>set_sponsorship_timeout</feature_eiffel_name>
				<feature_external_name>set_SponsorshipTimeout</feature_external_name>
				<arguments>
					<argument>
						<argument_eiffel_name>value</argument_eiffel_name>
						<argument_external_name>value</argument_external_name>
						<argument_type>SYSTEM_TIMESPAN</argument_type>
						<argument_type_full_name>System.TimeSpan</argument_type_full_name>
					</argument>
				</arguments>
				<return_type />
				<return_type_full_name>System.Void</return_type_full_name>
			</feature>
			<feature>
				<feature_modified>False</feature_modified>
				<frozen_feature>True</frozen_feature>
				<static>True</static>
				<abstract>False</abstract>
				<method>True</method>
				<field>False</field>
				<creation_routine>False</creation_routine>
				<prefix>False</prefix>
				<infix>False</infix>
				<new_slot>True</new_slot>
				<enum_literal>False</enum_literal>
				<is_literal>False</is_literal>
				<feature_eiffel_name>set_lease_time</feature_eiffel_name>
				<feature_external_name>set_LeaseTime</feature_external_name>
				<arguments>
					<argument>
						<argument_eiffel_name>value</argument_eiffel_name>
						<argument_external_name>value</argument_external_name>
						<argument_type>SYSTEM_TIMESPAN</argument_type>
						<argument_type_full_name>System.TimeSpan</argument_type_full_name>
					</argument>
				</arguments>
				<return_type />
				<return_type_full_name>System.Void</return_type_full_name>
			</feature>
		</element_change>
		<bit_or_infix>False</bit_or_infix>
	</body>
</class>