<!DOCTYPE type SYSTEM "../type.dtd">
<class>
	<header>
		<modified>False</modified>
		<frozen>True</frozen>
		<expanded>True</expanded>
		<deferred>False</deferred>
		<generic>False</generic>
		<class_eiffel_name>SYSTEM_XML_XPATH_XMLDATATYPE</class_eiffel_name>
		<alias>
			<simple_name>XmlDataType</simple_name>
			<namespace>System.Xml.XPath</namespace>
			<assembly_name>System.Xml</assembly_name>
			<assembly_version>1.0.2411.0</assembly_version>
			<assembly_culture>neutral</assembly_culture>
			<assembly_public_key>b77a5c561934e089</assembly_public_key>
			<enum_type>INTEGER</enum_type>
		</alias>
		<inherit>
			<parent>
				<parent_name>SYSTEM_ICOMPARABLE</parent_name>
				<rename>is_equal as equals_object</rename>
			</parent>
			<parent>
				<parent_name>SYSTEM_IFORMATTABLE</parent_name>
				<rename>is_equal as equals_object</rename>
			</parent>
			<parent>
				<parent_name>ENUM</parent_name>
				<rename>is_equal as equals_object</rename>
			</parent>
		</inherit>
		<create_none>True</create_none>
	</header>
	<body>
		<access>
			<feature>
				<feature_modified>False</feature_modified>
				<frozen_feature>True</frozen_feature>
				<static>True</static>
				<abstract>False</abstract>
				<method>False</method>
				<field>True</field>
				<creation_routine>False</creation_routine>
				<prefix>False</prefix>
				<infix>False</infix>
				<new_slot>True</new_slot>
				<enum_literal>True</enum_literal>
				<is_literal>True</is_literal>
				<feature_eiffel_name>number</feature_eiffel_name>
				<feature_external_name>2</feature_external_name>
				<return_type>SYSTEM_XML_XPATH_XMLDATATYPE</return_type>
				<return_type_full_name>System.Xml.XPath.XmlDataType</return_type_full_name>
			</feature>
			<feature>
				<feature_modified>False</feature_modified>
				<frozen_feature>True</frozen_feature>
				<static>True</static>
				<abstract>False</abstract>
				<method>False</method>
				<field>True</field>
				<creation_routine>False</creation_routine>
				<prefix>False</prefix>
				<infix>False</infix>
				<new_slot>True</new_slot>
				<enum_literal>True</enum_literal>
				<is_literal>True</is_literal>
				<feature_eiffel_name>text</feature_eiffel_name>
				<feature_external_name>1</feature_external_name>
				<return_type>SYSTEM_XML_XPATH_XMLDATATYPE</return_type>
				<return_type_full_name>System.Xml.XPath.XmlDataType</return_type_full_name>
			</feature>
		</access>
		<bit_or_infix>False</bit_or_infix>
	</body>
</class>
