<!DOCTYPE type SYSTEM "../type.dtd">
<class>
	<header>
		<modified>False</modified>
		<frozen>False</frozen>
		<expanded>False</expanded>
		<deferred>False</deferred>
		<generic>False</generic>
		<class_eiffel_name>SYSTEM_WINDOWS_FORMS_PROPERTYGRIDINTERNAL_PROPERTIESTAB</class_eiffel_name>
		<alias>
			<simple_name>PropertiesTab</simple_name>
			<namespace>System.Windows.Forms.PropertyGridInternal</namespace>
			<assembly_name>System.Windows.Forms</assembly_name>
			<assembly_version>1.0.2411.0</assembly_version>
			<assembly_culture>neutral</assembly_culture>
			<assembly_public_key>b77a5c561934e089</assembly_public_key>
		</alias>
		<inherit>
			<parent>
				<parent_name>SYSTEM_COMPONENTMODEL_IEXTENDERPROVIDER</parent_name>
			</parent>
			<parent>
				<parent_name>SYSTEM_WINDOWS_FORMS_DESIGN_PROPERTYTAB</parent_name>
				<redefine>get_properties_itype_descriptor_context, get_default_property, get_help_keyword</redefine>
			</parent>
		</inherit>
		<create_none>False</create_none>
	</header>
	<body>
		<initialization>
			<feature>
				<feature_modified>False</feature_modified>
				<frozen_feature>True</frozen_feature>
				<static>False</static>
				<abstract>False</abstract>
				<method>False</method>
				<field>False</field>
				<creation_routine>True</creation_routine>
				<prefix>False</prefix>
				<infix>False</infix>
				<new_slot>False</new_slot>
				<enum_literal>False</enum_literal>
				<is_literal>False</is_literal>
				<feature_eiffel_name>make_propertiestab</feature_eiffel_name>
			</feature>
		</initialization>
		<access>
			<feature>
				<feature_modified>False</feature_modified>
				<frozen_feature>False</frozen_feature>
				<static>False</static>
				<abstract>False</abstract>
				<method>True</method>
				<field>False</field>
				<creation_routine>False</creation_routine>
				<prefix>False</prefix>
				<infix>False</infix>
				<new_slot>False</new_slot>
				<enum_literal>False</enum_literal>
				<is_literal>False</is_literal>
				<feature_eiffel_name>get_tab_name</feature_eiffel_name>
				<feature_external_name>get_TabName</feature_external_name>
				<return_type>STRING</return_type>
				<return_type_full_name>System.String</return_type_full_name>
			</feature>
			<feature>
				<feature_modified>False</feature_modified>
				<frozen_feature>False</frozen_feature>
				<static>False</static>
				<abstract>False</abstract>
				<method>True</method>
				<field>False</field>
				<creation_routine>False</creation_routine>
				<prefix>False</prefix>
				<infix>False</infix>
				<new_slot>False</new_slot>
				<enum_literal>False</enum_literal>
				<is_literal>False</is_literal>
				<feature_eiffel_name>get_help_keyword</feature_eiffel_name>
				<feature_external_name>get_HelpKeyword</feature_external_name>
				<return_type>STRING</return_type>
				<return_type_full_name>System.String</return_type_full_name>
			</feature>
		</access>
		<basic_operations>
			<feature>
				<feature_modified>False</feature_modified>
				<frozen_feature>False</frozen_feature>
				<static>False</static>
				<abstract>False</abstract>
				<method>True</method>
				<field>False</field>
				<creation_routine>False</creation_routine>
				<prefix>False</prefix>
				<infix>False</infix>
				<new_slot>False</new_slot>
				<enum_literal>False</enum_literal>
				<is_literal>False</is_literal>
				<feature_eiffel_name>get_properties_object_array_attribute</feature_eiffel_name>
				<feature_external_name>GetProperties</feature_external_name>
				<arguments>
					<argument>
						<argument_eiffel_name>component</argument_eiffel_name>
						<argument_external_name>component</argument_external_name>
						<argument_type>ANY</argument_type>
						<argument_type_full_name>System.Object</argument_type_full_name>
					</argument>
					<argument>
						<argument_eiffel_name>attributes</argument_eiffel_name>
						<argument_external_name>attributes</argument_external_name>
						<argument_type>ARRAY [SYSTEM_ATTRIBUTE]</argument_type>
						<argument_type_full_name>System.Attribute[]</argument_type_full_name>
					</argument>
				</arguments>
				<return_type>SYSTEM_COMPONENTMODEL_PROPERTYDESCRIPTORCOLLECTION</return_type>
				<return_type_full_name>System.ComponentModel.PropertyDescriptorCollection</return_type_full_name>
			</feature>
			<feature>
				<feature_modified>False</feature_modified>
				<frozen_feature>False</frozen_feature>
				<static>False</static>
				<abstract>False</abstract>
				<method>True</method>
				<field>False</field>
				<creation_routine>False</creation_routine>
				<prefix>False</prefix>
				<infix>False</infix>
				<new_slot>False</new_slot>
				<enum_literal>False</enum_literal>
				<is_literal>False</is_literal>
				<feature_eiffel_name>get_default_property</feature_eiffel_name>
				<feature_external_name>GetDefaultProperty</feature_external_name>
				<arguments>
					<argument>
						<argument_eiffel_name>obj</argument_eiffel_name>
						<argument_external_name>obj</argument_external_name>
						<argument_type>ANY</argument_type>
						<argument_type_full_name>System.Object</argument_type_full_name>
					</argument>
				</arguments>
				<return_type>SYSTEM_COMPONENTMODEL_PROPERTYDESCRIPTOR</return_type>
				<return_type_full_name>System.ComponentModel.PropertyDescriptor</return_type_full_name>
			</feature>
			<feature>
				<feature_modified>False</feature_modified>
				<frozen_feature>False</frozen_feature>
				<static>False</static>
				<abstract>False</abstract>
				<method>True</method>
				<field>False</field>
				<creation_routine>False</creation_routine>
				<prefix>False</prefix>
				<infix>False</infix>
				<new_slot>False</new_slot>
				<enum_literal>False</enum_literal>
				<is_literal>False</is_literal>
				<feature_eiffel_name>get_properties_itype_descriptor_context</feature_eiffel_name>
				<feature_external_name>GetProperties</feature_external_name>
				<arguments>
					<argument>
						<argument_eiffel_name>context</argument_eiffel_name>
						<argument_external_name>context</argument_external_name>
						<argument_type>SYSTEM_COMPONENTMODEL_ITYPEDESCRIPTORCONTEXT</argument_type>
						<argument_type_full_name>System.ComponentModel.ITypeDescriptorContext</argument_type_full_name>
					</argument>
					<argument>
						<argument_eiffel_name>component</argument_eiffel_name>
						<argument_external_name>component</argument_external_name>
						<argument_type>ANY</argument_type>
						<argument_type_full_name>System.Object</argument_type_full_name>
					</argument>
					<argument>
						<argument_eiffel_name>attributes</argument_eiffel_name>
						<argument_external_name>attributes</argument_external_name>
						<argument_type>ARRAY [SYSTEM_ATTRIBUTE]</argument_type>
						<argument_type_full_name>System.Attribute[]</argument_type_full_name>
					</argument>
				</arguments>
				<return_type>SYSTEM_COMPONENTMODEL_PROPERTYDESCRIPTORCOLLECTION</return_type>
				<return_type_full_name>System.ComponentModel.PropertyDescriptorCollection</return_type_full_name>
			</feature>
		</basic_operations>
		<bit_or_infix>False</bit_or_infix>
	</body>
</class>