<!DOCTYPE type SYSTEM "../type.dtd">
<class>
	<header>
		<modified>False</modified>
		<frozen>False</frozen>
		<expanded>False</expanded>
		<deferred>False</deferred>
		<generic>False</generic>
		<class_eiffel_name>SYSTEM_NET_PROTOCOLVIOLATIONEXCEPTION</class_eiffel_name>
		<alias>
			<simple_name>ProtocolViolationException</simple_name>
			<namespace>System.Net</namespace>
			<assembly_name>System</assembly_name>
			<assembly_version>1.0.2411.0</assembly_version>
			<assembly_culture>neutral</assembly_culture>
			<assembly_public_key>b77a5c561934e089</assembly_public_key>
		</alias>
		<inherit>
			<parent>
				<parent_name>SYSTEM_RUNTIME_SERIALIZATION_ISERIALIZABLE</parent_name>
				<rename>get_object_data as system_runtime_serialization_iserializable_get_object_data</rename>
			</parent>
			<parent>
				<parent_name>SYSTEM_EXCEPTION</parent_name>
				<rename>get_object_data as system_runtime_serialization_iserializable_get_object_data</rename>
				<redefine>system_runtime_serialization_iserializable_get_object_data</redefine>
			</parent>
		</inherit>
		<create_none>False</create_none>
	</header>
	<body>
		<initialization>
			<feature>
				<feature_modified>False</feature_modified>
				<frozen_feature>True</frozen_feature>
				<static>False</static>
				<abstract>False</abstract>
				<method>False</method>
				<field>False</field>
				<creation_routine>True</creation_routine>
				<prefix>False</prefix>
				<infix>False</infix>
				<new_slot>False</new_slot>
				<enum_literal>False</enum_literal>
				<is_literal>False</is_literal>
				<feature_eiffel_name>make_protocolviolationexception_1</feature_eiffel_name>
				<arguments>
					<argument>
						<argument_eiffel_name>message</argument_eiffel_name>
						<argument_external_name>message</argument_external_name>
						<argument_type>STRING</argument_type>
						<argument_type_full_name>System.String</argument_type_full_name>
					</argument>
				</arguments>
			</feature>
			<feature>
				<feature_modified>False</feature_modified>
				<frozen_feature>True</frozen_feature>
				<static>False</static>
				<abstract>False</abstract>
				<method>False</method>
				<field>False</field>
				<creation_routine>True</creation_routine>
				<prefix>False</prefix>
				<infix>False</infix>
				<new_slot>False</new_slot>
				<enum_literal>False</enum_literal>
				<is_literal>False</is_literal>
				<feature_eiffel_name>make_protocolviolationexception</feature_eiffel_name>
			</feature>
		</initialization>
		<implementation>
			<feature>
				<feature_modified>False</feature_modified>
				<frozen_feature>True</frozen_feature>
				<static>False</static>
				<abstract>False</abstract>
				<method>True</method>
				<field>False</field>
				<creation_routine>False</creation_routine>
				<prefix>False</prefix>
				<infix>False</infix>
				<new_slot>True</new_slot>
				<enum_literal>False</enum_literal>
				<is_literal>False</is_literal>
				<feature_eiffel_name>system_runtime_serialization_iserializable_get_object_data</feature_eiffel_name>
				<feature_external_name>System.Runtime.Serialization.ISerializable.GetObjectData</feature_external_name>
				<arguments>
					<argument>
						<argument_eiffel_name>serialization_info</argument_eiffel_name>
						<argument_external_name>serializationInfo</argument_external_name>
						<argument_type>SYSTEM_RUNTIME_SERIALIZATION_SERIALIZATIONINFO</argument_type>
						<argument_type_full_name>System.Runtime.Serialization.SerializationInfo</argument_type_full_name>
					</argument>
					<argument>
						<argument_eiffel_name>streaming_context</argument_eiffel_name>
						<argument_external_name>streamingContext</argument_external_name>
						<argument_type>SYSTEM_RUNTIME_SERIALIZATION_STREAMINGCONTEXT</argument_type>
						<argument_type_full_name>System.Runtime.Serialization.StreamingContext</argument_type_full_name>
					</argument>
				</arguments>
				<return_type />
				<return_type_full_name>System.Void</return_type_full_name>
			</feature>
		</implementation>
		<bit_or_infix>False</bit_or_infix>
	</body>
</class>